[
  {
    "label": "human-like-synthetic",
    "source": "synthetic-train",
    "session_id": "synthetic-train-human-000",
    "seed": 42,
    "stats": {
      "averageInterval": 183.94,
      "stdInterval": 26.13,
      "pauseCount": 2,
      "rhythmVector": [
        9,
        5,
        3,
        25,
        18
      ]
    }
  },
  {
    "label": "human-like-synthetic",
    "source": "synthetic-train",
    "session_id": "synthetic-train-human-001",
    "seed": 42,
    "stats": {
      "averageInterval": 179.05,
      "stdInterval": 26.43,
      "pauseCount": 0,
      "rhythmVector": [
        9,
        19,
        1,
        7,
        24
      ]
    }
  },
  {
    "label": "human-like-synthetic",
    "source": "synthetic-train",
    "session_id": "synthetic-train-human-002",
    "seed": 42,
    "stats": {
      "averageInterval": 174.49,
      "stdInterval": 34.92,
      "pauseCount": 2,
      "rhythmVector": [
        18,
        0,
        18,
        16,
        8
      ]
    }
  },
  {
    "label": "human-like-synthetic",
    "source": "synthetic-train",
    "session_id": "synthetic-train-human-003",
    "seed": 42,
    "stats": {
      "averageInterval": 135.55,
      "stdInterval": 68.07,
      "pauseCount": 3,
      "rhythmVector": [
        4,
        16,
        15,
        14,
        11
      ]
    }
  },
  {
    "label": "human-like-synthetic",
    "source": "synthetic-train",
    "session_id": "synthetic-train-human-004",
    "seed": 42,
    "stats": {
      "averageInterval": 124.35,
      "stdInterval": 45.67,
      "pauseCount": 0,
      "rhythmVector": [
        17,
        7,
        10,
        15,
        11
      ]
    }
  },
  {
    "label": "human-like-synthetic",
    "source": "synthetic-train",
    "session_id": "synthetic-train-human-005",
    "seed": 42,
    "stats": {
      "averageInterval": 206.17,
      "stdInterval": 50.98,
      "pauseCount": 0,
      "rhythmVector": [
        3,
        16,
        20,
        5,
        16
      ]
    }
  },
  {
    "label": "human-like-synthetic",
    "source": "synthetic-train",
    "session_id": "synthetic-train-human-006",
    "seed": 42,
    "stats": {
      "averageInterval": 130.1,
      "stdInterval": 37.51,
      "pauseCount": 3,
      "rhythmVector": [
        4,
        8,
        16,
        16,
        16
      ]
    }
  },
  {
    "label": "human-like-synthetic",
    "source": "synthetic-train",
    "session_id": "synthetic-train-human-007",
    "seed": 42,
    "stats": {
      "averageInterval": 127.14,
      "stdInterval": 53.57,
      "pauseCount": 1,
      "rhythmVector": [
        4,
        8,
        22,
        14,
        12
      ]
    }
  },
  {
    "label": "human-like-synthetic",
    "source": "synthetic-train",
    "session_id": "synthetic-train-human-008",
    "seed": 42,
    "stats": {
      "averageInterval": 188.46,
      "stdInterval": 62.93,
      "pauseCount": 0,
      "rhythmVector": [
        13,
        2,
        18,
        15,
        12
      ]
    }
  },
  {
    "label": "human-like-synthetic",
    "source": "synthetic-train",
    "session_id": "synthetic-train-human-009",
    "seed": 42,
    "stats": {
      "averageInterval": 214.29,
      "stdInterval": 64.44,
      "pauseCount": 3,
      "rhythmVector": [
        5,
        13,
        22,
        16,
        4
      ]
    }
  },
  {
    "label": "human-like-synthetic",
    "source": "synthetic-train",
    "session_id": "synthetic-train-human-010",
    "seed": 42,
    "stats": {
      "averageInterval": 133.96,
      "stdInterval": 58.52,
      "pauseCount": 2,
      "rhythmVector": [
        15,
        8,
        11,
        7,
        19
      ]
    }
  },
  {
    "label": "human-like-synthetic",
    "source": "synthetic-train",
    "session_id": "synthetic-train-human-011",
    "seed": 42,
    "stats": {
      "averageInterval": 133.83,
      "stdInterval": 47.21,
      "pauseCount": 0,
      "rhythmVector": [
        20,
        4,
        4,
        17,
        15
      ]
    }
  },
  {
    "label": "human-like-synthetic",
    "source": "synthetic-train",
    "session_id": "synthetic-train-human-012",
    "seed": 42,
    "stats": {
      "averageInterval": 158.48,
      "stdInterval": 51.81,
      "pauseCount": 6,
      "rhythmVector": [
        10,
        19,
        17,
        0,
        14
      ]
    }
  },
  {
    "label": "human-like-synthetic",
    "source": "synthetic-train",
    "session_id": "synthetic-train-human-013",
    "seed": 42,
    "stats": {
      "averageInterval": 188.17,
      "stdInterval": 49.16,
      "pauseCount": 2,
      "rhythmVector": [
        30,
        13,
        11,
        6,
        0
      ]
    }
  },
  {
    "label": "human-like-synthetic",
    "source": "synthetic-train",
    "session_id": "synthetic-train-human-014",
    "seed": 42,
    "stats": {
      "averageInterval": 192.21,
      "stdInterval": 57.39,
      "pauseCount": 1,
      "rhythmVector": [
        12,
        2,
        14,
        20,
        12
      ]
    }
  },
  {
    "label": "human-like-synthetic",
    "source": "synthetic-train",
    "session_id": "synthetic-train-human-015",
    "seed": 42,
    "stats": {
      "averageInterval": 139.89,
      "stdInterval": 41.83,
      "pauseCount": 1,
      "rhythmVector": [
        15,
        21,
        15,
        0,
        9
      ]
    }
  },
  {
    "label": "human-like-synthetic",
    "source": "synthetic-train",
    "session_id": "synthetic-train-human-016",
    "seed": 42,
    "stats": {
      "averageInterval": 121.95,
      "stdInterval": 66.81,
      "pauseCount": 2,
      "rhythmVector": [
        7,
        8,
        18,
        3,
        24
      ]
    }
  },
  {
    "label": "human-like-synthetic",
    "source": "synthetic-train",
    "session_id": "synthetic-train-human-017",
    "seed": 42,
    "stats": {
      "averageInterval": 201.6,
      "stdInterval": 69.01,
      "pauseCount": 1,
      "rhythmVector": [
        4,
        12,
        14,
        7,
        23
      ]
    }
  },
  {
    "label": "human-like-synthetic",
    "source": "synthetic-train",
    "session_id": "synthetic-train-human-018",
    "seed": 42,
    "stats": {
      "averageInterval": 162.31,
      "stdInterval": 34.53,
      "pauseCount": 1,
      "rhythmVector": [
        14,
        8,
        13,
        7,
        18
      ]
    }
  },
  {
    "label": "human-like-synthetic",
    "source": "synthetic-train",
    "session_id": "synthetic-train-human-019",
    "seed": 42,
    "stats": {
      "averageInterval": 165.15,
      "stdInterval": 36.16,
      "pauseCount": 0,
      "rhythmVector": [
        14,
        24,
        10,
        9,
        3
      ]
    }
  },
  {
    "label": "human-like-synthetic",
    "source": "synthetic-train",
    "session_id": "synthetic-train-human-020",
    "seed": 42,
    "stats": {
      "averageInterval": 183.11,
      "stdInterval": 35.3,
      "pauseCount": 0,
      "rhythmVector": [
        25,
        2,
        7,
        20,
        6
      ]
    }
  },
  {
    "label": "human-like-synthetic",
    "source": "synthetic-train",
    "session_id": "synthetic-train-human-021",
    "seed": 42,
    "stats": {
      "averageInterval": 133.23,
      "stdInterval": 67.1,
      "pauseCount": 6,
      "rhythmVector": [
        8,
        15,
        13,
        3,
        21
      ]
    }
  },
  {
    "label": "human-like-synthetic",
    "source": "synthetic-train",
    "session_id": "synthetic-train-human-022",
    "seed": 42,
    "stats": {
      "averageInterval": 155.43,
      "stdInterval": 43.5,
      "pauseCount": 0,
      "rhythmVector": [
        16,
        24,
        2,
        10,
        8
      ]
    }
  },
  {
    "label": "human-like-synthetic",
    "source": "synthetic-train",
    "session_id": "synthetic-train-human-023",
    "seed": 42,
    "stats": {
      "averageInterval": 206.17,
      "stdInterval": 36.19,
      "pauseCount": 1,
      "rhythmVector": [
        14,
        4,
        5,
        13,
        24
      ]
    }
  },
  {
    "label": "human-like-synthetic",
    "source": "synthetic-train",
    "session_id": "synthetic-train-human-024",
    "seed": 42,
    "stats": {
      "averageInterval": 127.54,
      "stdInterval": 61.36,
      "pauseCount": 0,
      "rhythmVector": [
        1,
        16,
        13,
        15,
        15
      ]
    }
  },
  {
    "label": "human-like-synthetic",
    "source": "synthetic-train",
    "session_id": "synthetic-train-human-025",
    "seed": 42,
    "stats": {
      "averageInterval": 204.87,
      "stdInterval": 32.48,
      "pauseCount": 6,
      "rhythmVector": [
        13,
        21,
        22,
        4,
        0
      ]
    }
  },
  {
    "label": "human-like-synthetic",
    "source": "synthetic-train",
    "session_id": "synthetic-train-human-026",
    "seed": 42,
    "stats": {
      "averageInterval": 159.04,
      "stdInterval": 66.69,
      "pauseCount": 6,
      "rhythmVector": [
        5,
        13,
        14,
        15,
        13
      ]
    }
  },
  {
    "label": "human-like-synthetic",
    "source": "synthetic-train",
    "session_id": "synthetic-train-human-027",
    "seed": 42,
    "stats": {
      "averageInterval": 168.67,
      "stdInterval": 33.55,
      "pauseCount": 1,
      "rhythmVector": [
        20,
        12,
        11,
        16,
        1
      ]
    }
  },
  {
    "label": "human-like-synthetic",
    "source": "synthetic-train",
    "session_id": "synthetic-train-human-028",
    "seed": 42,
    "stats": {
      "averageInterval": 178.42,
      "stdInterval": 47.63,
      "pauseCount": 1,
      "rhythmVector": [
        1,
        20,
        33,
        3,
        3
      ]
    }
  },
  {
    "label": "human-like-synthetic",
    "source": "synthetic-train",
    "session_id": "synthetic-train-human-029",
    "seed": 42,
    "stats": {
      "averageInterval": 206.18,
      "stdInterval": 43.17,
      "pauseCount": 1,